{
  "$schema": "http://json-schema.org/draft-04/schema#",
  "title": "Simple Licence Schema",
  "type": "object",
  "properties": {
    "source_url": {
      "description": "Place where this fact can be verified",
      "type": "string"
    },
    "sample_date": {
      "description": "Date on which this fact was known to be true",
      "type": "string"
    },
    "confidence": {
      "description": "Confidence in accuracy of data",
      "type": "string",
      "enum": ["HIGH", "MEDIUM", "LOW"]
    },
    "company_name": {
      "description": "Name of the company holding the licence",
      "type": "string"
    },
    "company_jurisdiction": {
      "description": "Jurisdiction where company is based",
      "type": "string"
    },
    "licence_number": {
      "description": "Licence number or code",
      "type": "string"
    },
    "jurisdiction_classification": {
      "description": "Classification of licence by the regulator",
      "type": "string"
    },
    "regulator": {
      "description": "The regulating body that issued the licence",
      "type": "string"
    },
    "licence_jurisdiction": {
      "description": "Jurisdiction for which licence is issued",
      "type": "string"
    },
    "status": {
      "description": "Status of the licence",
      "type": "string"
    },
    "category": {
      "description": "Category of licence",
      "type": "string",
      "enum": ["Financial", "Business"]
    }
  },
  "required": ["source_url", "sample_date", "company_name", "company_jurisdiction"]
}
