{
	"company_name": "Foo Corporation",
	"company_jurisdiction": "us_ny",
	"category": "Business",
	"licence_number": "ABC123",
	"jurisdiction_classification": "Funeral Parlour",
	"licence_jurisdiction": "New York City",
	"source_url": "http://example.com/abc123",
	"sample_date": "2014-06-01",
	"confidence": "MEDIUM"
}
